<?xml version="1.0" encoding="UTF-8"?>
<RegistoConsultas 
    xmlns:xsi="http://www.w3.org/2001/XMLSchema-instance"
    xsi:noNamespaceSchemaLocation="consultas.xsd">
    
    <Cabecalho>
        <HospitalID>HOSP_001</HospitalID>
        
        <RegistoID>CONS_HOSP_001_202510</RegistoID> 
        
        <PeriodoReferencia>
            <Mes>10</Mes>
            <Ano>2025</Ano>
        </PeriodoReferencia>
    </Cabecalho>
    
    <EspecialidadeRegisto>
        <Especialidade>Cardiologia</Especialidade>
        
        <PopulacaoAlvo>adulto</PopulacaoAlvo>
        
        <ListasEspera>
            <Geral>
                <UtentesEmLista>500</UtentesEmLista>
            </Geral>
            <NaoOncologica>
                <UtentesEmLista>450</UtentesEmLista>
            </NaoOncologica>
            <Oncologica>
                <UtentesEmLista>50</UtentesEmLista>
            </Oncologica>
        </ListasEspera>
        
        <TemposMediosResposta>
            <Normal>
                <TMR_dias>90</TMR_dias> </Normal>
            <Prioritario>
                <TMR_dias>45</TMR_dias> </Prioritario>
            <MuitoPrioritario>
                <TMR_dias>10</TMR_dias> </MuitoPrioritario>
        </TemposMediosResposta>
    </EspecialidadeRegisto>
    
</RegistoConsultas>